{
  "schemaVersion" : "matching.m13.environment.v1",
  "status" : "PASS",
  "javaRuntime" : "OpenJDK Runtime Environment",
  "javaVersion" : "25.0.4.1+1-LTS",
  "javaVendor" : "Eclipse Adoptium",
  "vmName" : "OpenJDK 64-Bit Server VM",
  "jvmArguments" : [ "-Daeron.socket.so_rcvbuf=0", "--add-opens=java.base/jdk.internal.misc=ALL-UNNAMED", "-Dfile.encoding=UTF-8", "-Duser.country=CN", "-Duser.language=zh", "-Duser.variant" ],
  "osName" : "Mac OS X",
  "osVersion" : "26.0.1",
  "osArchitecture" : "aarch64",
  "availableProcessors" : 8,
  "physicalMemoryBytes" : 8589934592,
  "maximumHeapBytes" : 2147483648,
  "garbageCollectorNames" : [ "G1 Concurrent GC", "G1 Old Generation", "G1 Young Generation" ],
  "cpuModel" : "M13_CORRECTNESS_CPU_NOT_PROFILED",
  "storageDevice" : "M13_LOCAL_CLUSTER_STORAGE_NOT_QUALIFIED",
  "filesystem" : "M13_LOCAL_FILESYSTEM_NOT_QUALIFIED",
  "powerPolicy" : "M13_CORRECTNESS_POWER_POLICY_NOT_PROFILED",
  "walRoot" : "/Users/reln/Documents/Codex/2026-09-07/ji/work/cex-m14-release-check/build/reports/m13",
  "walRootUri" : "file:///Users/reln/Documents/Codex/2026-09-07/ji/work/cex-m14-release-check/build/reports/m13/",
  "walFileStoreName" : "/dev/disk3s5",
  "walFileStoreType" : "apfs",
  "walFileStoreTotalSpaceBytes" : 245107195904,
  "walFileStoreUsableSpaceBytes" : 20924510208,
  "walFileStoreUnallocatedSpaceBytes" : 20924510208,
  "runStartedAt" : "2026-09-07T13:23:10.644466Z",
  "runFinishedAt" : "2026-09-07T13:24:14.939205Z",
  "correctnessOnly" : true,
  "performanceQualified" : false,
  "singleHost" : true
}
